code;name
ICC008;PROGRAMAÇÃO PARA DISPOSITIVOS MÓVEIS USANDO TECNOLOGIAS WEB
ICC009;DESENVOLVIMENTO DE APLICATIVOS PARA DISPOSITIVOS MÓVEIS
ICC012;LABORATÓRIO DE PROGRAMAÇÃO B
ICC013;LABORATÓRIO DE PROGRAMAÇÃO C
ICC015;DESAFIOS DE PROGRAMAÇÃO I
ICC016;DESAFIOS DE PROGRAMAÇÃO II
ICC017;DESAFIOS DE PROGRAMAÇÃO III
ICC021;PRÁTICA EM PROGRAMAÇÃO I
ICC022;PRÁTICA EM PROGRAMAÇÃO II
ICC023;PRÁTICA EM PROGRAMAÇÃO III
ICC024;PRÁTICA EM PROGRAMAÇÃO IV
ICC026;DESAFIOS DE PROGRAMAÇÃO IV
ICC030;TÓPICOS ESPECIAIS EM PROGRAMAÇÃO I
ICC031;TÓPICOS ESPECIAIS EM PROGRAMAÇÃO II
ICC032;TÓPICOS ESPECIAIS EM PROGRAMAÇÃO III
ICC033;TÓPICOS ESPECIAIS EM PROGRAMAÇÃO IV
ICC034;TÓPICOS ESPECIAIS EM PROGRAMAÇÃO V
ICC035;TÓPICOS ESPECIAIS EM PROGRAMAÇÃO VI
ICC064;SISTEMAS DE COMPUTAÇÃO
ICC123;TÓPICOS ESPECIAIS EM ESTATÍSTICA APLICADA À COMPUTAÇÃO
ICC130;EXPERIÊNCIA CRIATIVA I
ICC131;EXPERIÊNCIA CRIATIVA II
ICC180;TÓPICOS ESPECIAIS EM CIÊNCIA DA COMPUTAÇÃO I
ICC181;TÓPICOS ESPECIAIS EM CIÊNCIA DA COMPUTAÇÃO II
ICC182;TÓPICOS AVANÇADOS EM CIÊNCIA DA COMPUTAÇÃO I
ICC183;TÓPICOS AVANÇADOS EM CIÊNCIA DA COMPUTAÇÃO II
ICC190;TÓPICOS ESPECIAIS EM SISTEMAS DE INFORMAÇÃO I
ICC191;TÓPICOS ESPECIAIS EM SISTEMAS DE INFORMAÇÃO II
ICC192;TÓPICOS AVANÇADOS EM SISTEMAS DE INFORMAÇÃO I
ICC193;TÓPICOS AVANÇADOS EM SISTEMAS DE INFORMAÇÃO II
ICC201;BANCOS DE DADOS II
ICC202;RECUPERAÇÃO DE INFORMAÇÃO MULTIMÍDIA
ICC203;GERÊNCIA DE DADOS NA WEB
ICC204;APRENDIZAGEM DE MÁQUINA E MINERAÇÃO DE DADOS
ICC220;TÓPICOS ESPECIAIS EM BANCO DE DADOS
ICC221;TÓPICOS AVANÇADOS EM BANCO DE DADOS
ICC222;TÓPICOS EM RECUPERAÇÃO DE INFORMAÇÃO
ICC223;TÓPICOS ESPECIAIS EM APRENDIZAGEM DE MÁQUINA
ICC224;TÓPICOS AVANÇADOS EM APRENDIZAGEM DE MÁQUINA
ICC251;SISTEMAS AUTONÔMICOS
ICC252;SISTEMAS COLABORATIVOS MÓVEIS
ICC266;CONSTRUÇÃO DO CONHECIMENTO
ICC270;TÓPICOS ESPECIAIS EM INTELIGÊNCIA ARTIFICIAL
ICC271;TÓPICOS AVANÇADOS EM INTELIGÊNCIA ARTIFICIAL
ICC302;GERÊNCIA DE REDES DE COMPUTADORES
ICC303;SEGURANÇA EM REDES DE COMPUTADORES
ICC304;COMUNICAÇÃO SEM FIO
ICC306;REDES DE SENSORES SEM FIO
ICC307;SEGURANÇA E AUDITORIA  DE SISTEMAS DE INFORMAÇÃO
ICC308;REDES DE DISTRIBUIÇÃO DE CONTEÚDOS
ICC310;PRÁTICA EM REDES DE COMPUTADORES I
ICC311;PRÁTICA EM REDES DE COMPUTADORES II
ICC312;PRÁTICA EM REDES DE COMPUTADORES III
ICC313;AUDITORIA E SEGURANÇA DE SISTEMAS
ICC320;TÓPICOS ESPECIAIS EM REDES DE COMPUTADORES
ICC321;TÓPICOS ESPECIAIS EM SISTEMAS DISTRIBUÍDOS
ICC322;TÓPICOS AVANÇADOS EM REDES DE COMPUTADORES
ICC323;TÓPICOS AVANÇADOS EM SISTEMAS DISTRIBUÍDOS
ICC350;INTRODUÇÃO AOS SISTEMAS EMBARCADOS
ICC351;SISTEMAS DE TEMPO REAL
ICC352;SISTEMAS DE EVENTOS DISCRETOS
ICC360;PRÁTICA EM SISTEMAS EMBARCADOS I
ICC361;PRÁTICA EM SISTEMAS EMBARCADOS II
ICC370;TÓPICOS ESPECIAIS EM SISTEMAS EMBARCADOS
ICC371;TÓPICOS AVANÇADOS EM SISTEMAS EMBARCADOS
ICC372;TÓPICOS ESPECIAIS EM ARQUITETURA DE SOFTWARE
ICC373;TÓPICOS AVANÇADOS EM ARQUITETURA DE SOFTWARE
ICC404;GERÊNCIA DE PROJETOS
ICC405;ENGENHARIA DE SOFTWARE EXPERIMENTAL
ICC407;PROJETO DE INTERAÇÃO COM O USUÁRIO DE DISPOSITIVOS MÓVEIS
ICC408;VERIFICAÇÃO E VALIDAÇÃO DE SOFTWARE
ICC412;PROCESSO DE DESENVOLVIMENTO DE SOFTWARE
ICC414;VERIFICAÇÃO, VALIDAÇÃO E TESTE DE SOFTWARE
ICC415;PROJETO E ARQUITETURA DE SISTEMAS
ICC417;GERÊNCIA DE CONFIGURAÇÃO
ICC420;TÓPICOS ESPECIAIS EM ENGENHARIA DE SOFTWARE I
ICC421;TÓPICOS AVANÇADOS EM ENGENHARIA DE SOFTWARE I
ICC422;TÓPICOS ESPECIAIS EM INTERAÇÃO HUMANO-COMPUTADOR
ICC423;TÓPICOS AVANÇADOS EM INTERAÇÃO HUMANO-COMPUTADOR
ICC424;TÓPICOS ESPECIAIS EM ENGENHARIA DE SOFTWARE II
ICC425;TÓPICOS AVANÇADOS EM ENGENHARIA DE SOFTWARE II
ICC451;ROBÓTICA MÓVEL INTELIGENTE
ICC452;VISÃO COMPUTACIONAL
ICC453;ANÁLISE E TRATAMENTO DE IMAGENS E VÍDEOS
ICC454;DESENVOLVIMENTO DE JOGOS DIGITAIS
ICC455;DESENVOLVIMENTO DE JOGOS PARA DISPOSITIVOS MÓVEIS
ICC460;PRÁTICA EM DESENVOLVIMENTO DE JOGOS DIGITAIS I
ICC461;PRÁTICA EM DESENVOLVIMENTO DE JOGOS DIGITAIS II
ICC462;PRÁTICA EM ROBÓTICA I
ICC463;PRÁTICA EM ROBÓTICA II
ICC470;TÓPICOS ESPECIAIS EM VISÃO COMPUTACIONAL E ROBÓTICA 
ICC471;TÓPICOS AVANÇADOS EM VISÃO COMPUTACIONAL E ROBÓTICA 
ICC500;INTRODUÇÃO À OTIMIZAÇÃO COMBINATÓRIA
ICC501;SIMULAÇÃO DE EVENTOS DISCRETOS
ICC502;INTRODUÇÃO A PESQUISA OPERACIONAL
ICC520;TÓPICOS ESPECIAIS EM OTIMIZAÇÃO
ICC521;TÓPICOS AVANÇADOS EM OTIMIZAÇÃO
ICC550;TÓPICOS ESPECIAIS EM PESQUISA EM EDUCAÇÃO EM COMPUTAÇÃO I
ICC551;TÓPICOS ESPECIAIS EM PESQUISA EM EDUCAÇÃO EM COMPUTAÇÃO II
ICC001;INTRODUÇÃO À COMPUTAÇÃO
ICC110;TEXTOS TÉCNICOS EM CIÊNCIA DA COMPUTAÇÃO
ICC111;SEMINÁRIOS EM COMPUTAÇÃO
ICC120;MATEMÁTICA DISCRETA
IEM012;ÁLGEBRA LINEAR I
IEM075;CÁLCULO DIFERENCIAL E INTEGRAL I
ICC002;ALGORITMOS E ESTRUTURA DE DADOS I
ICC040;LINGUAGENS FORMAIS E AUTÔMATOS
ICC060;SISTEMAS LÓGICOS
IEM022;ÁLGEBRA LINEAR II
IEM076;CÁLCULO DIFERENCIAL E INTEGRAL II
IHE130;INGLÊS INSTRUMENTAL I
ICC003;ALGORITMOS E ESTRUTURAS DE DADOS II
ICC061;ORGANIZAÇÃO DE COMPUTADORES
ICC102;METODOLOGIA CIENTÍFICA EM CIÊNCIA DA COMPUTAÇÃO
ICC121;COMPUTAÇÃO NUMÉRICA
IEF028;FÍSICA I E
IEF029;LABORATÓRIO DE FISICA I E
ICC025;TÉCNICAS AVANÇADAS DE PROGRAMAÇÃO
ICC043;PARADIGMA DE LINGUAGENS DE PROGRAMAÇÃO
ICC062;ARQUITETURA DE COMPUTADORES
ICC309;REDES DE COMPUTADORES
IEE001;PROBABILIDADE E ESTATISTICA
ICC006;PROJETO E ANÁLISE DE ALGORITMOS
ICC014;LABORATÓRIO DE PROGRAMAÇÃO AVANÇADA
ICC044;COMPILADORES
ICC065;SISTEMAS OPERACIONAIS I
ICC400;INTRODUÇÃO À ENGENHARIA DE SOFTWARE
ICC041;INTRODUÇÃO À TEORIA DOS GRAFOS
ICC200;BANCOS DE DADOS I
ICC265;INTELIGÊNCIA ARTIFICIAL
ICC401;ANÁLISE E PROJETO DE SISTEMAS
ICC450;INTRODUÇÃO À COMPUTAÇÃO GRÁFICA
FAA011;INTRODUÇÃO À ADMINISTRAÇÃO
ICC007;PROGRAMAÇÃO PARA WEB
ICC305;AVALIAÇÃO DE DESEMPENHO
ICC315;SISTEMAS DISTRIBUÍDOS I
ICC406;INTERAÇÃO HUMANO-COMPUTADOR
ICC104;INFORMÁTICA, ÉTICA E SOCIEDADE
ICC113;EMPREENDEDORISMO EM TECNOLOGIA DA INFORMAÇÃO
ICC150;TRABALHO DE CONCLUSÃO DE CURSO